title,content,date
Could someone please help me translate this message?,"እባክሺ በፍቅር አናግሪዉ  እዬናፈ ነዉ መሰለኝ አይዞህ በይዉ ሪሀብ  ግባ እመጣለሁ  በይዉ ተሰፋ ነዉ እዬለፈለፈነዉ አተቀዬሚዉ እሺ


Thank you so much!",2024-12-27 05:08:25
Learn Amharic ,,2024-12-23 19:09:41
When and why does the እ get added to the front of a word that starts with ር. ,"Sometimes I see that words in Amharic that I think should start with one of the ረ letters, starts with እ. For example ራሱን and እራሱን (and all the other forms of that word). And also እርዳኝ and ርዳኝ. What causes this to happen? Is it just a spelling difference or is it something else? Thank you.",2024-12-20 21:39:04
Difference between ደብር and ደብረ,Can someone explain the difference between ደብር and ደብረ when is comes to the names of churches/monasteries? Thank you!,2024-12-19 12:24:49
"3+ Ways to say ""I don't know"" in Amharic:",,2024-12-19 04:21:45
Could you advise what is written here?,,2024-12-16 05:16:42
Translating Song,"Selam everyone!

I heard this song recently and understand a majority of it, but my Amharic isn’t the best and sometimes I mishear words. 

I was wondering if someone could transcribe & translate this beautiful song for me as I know it has a nice meaning and would love to use it as a way to practice my pronunciation and learn Amharic vocab better. 

Thank you!",2024-12-14 17:20:22
is there an amharic name similar to hillel/hilal?,"So, I’m Jewish but I often get mistaken for arab because my name is hillel which sounds similar to the arabic name hilal

What’s intresting though is that they mean similar-ish things; hillel is a type of Jewish prayer while hilal refers to a crescent moon which is a holy symbols in both Islam and arabic culture 

So I’m curious, is there an Amharic name that’s similar? And what does it mean?",2024-12-14 11:18:14
Amharic translation help of old rifle script,,2024-12-11 15:13:24
How can I learn Amharic? ,"**How can I learn Amharic??** 

**You can learn Amharic like this:** 

**First, just believe that learning any language takes time.** 

**Learn something new every day.** 

**Practice what you have learned. You can practice by talking to yourself or others, and you can practice by writing and posting in Amharic in every group you find.** 

**Never give up even though there are no many resources to learn Amharic, start and use what you find in your way!**",2024-12-11 11:33:36
Are any of these phrases commonly used in Amharic?,"* **እግዚአብሔር አምላክ ነው** *(God is Lord)*
* **ክርስቶስ ሕይወቴ ነው** *(Christ is my life)*
* **በእግዚአብሔር አምናለሁ** *(I trust in God)*
* **የጌታ ምሕረት ለዘላለም ነው** *(The Lord's mercy endures forever)*
* **ሰላም ከእግዚአብሔር ይሁን** *(Peace be with God)*
* **እግዚአብሔር ከእኔ ጋር ነው** *(God is with me)*
* **የእግዚአብሔር ኃይል በእኔ ነው** *(The power of God is within me)*
* **አምላኬ የማዳኒ ነው** *(My God is my Savior)*
* **በጌታ እምነት አለኝ** *(I have faith in the Lord)*
* **እግዚአብሔር በጎ ነው** *(God is Good)*",2024-12-10 17:31:06
Can someone clarify something for me?,"ነገር ግን ከጥንት ጀምሮ በወርቅ ማንጠር፣፤ በብር ማፍሰስ፣ በብረታብረት ቅርጻቅርጽ ሥራዎች ታዋቁነትንና ተደናቂነትን ያተረፉት የአክሱም ከተማ ባለሙያዎች /ጠበብቶች/ የሚሠሯቸው ቅርጻቸው የረቀቀና ጥራት ያላቸው በመሆናቸው በመጽሐፍ ደጓሾች ዘንድ እስከ ፃያኛው ክፍለ ዘመን መጨረሻ በከፍተኛ ደረጃ ተወዳጅነትን አትርፈዋል፡፡

I vaguely understand from online translators that this is talking about metalworkers in Aksum that were highly regarded up to a certain time. However, depending on the translator, it gives a different century (one says ""until the end of the 19th century"" and another the 20th century. The man that helped me translate it many years ago wrote ""20th century"" but I just want to confirm since it is for a publication. Can someone please clarify for me?  
Thank you!",2024-12-09 12:14:06
Anyone know the name of this font?,"Reading a paper about Amharic from before the 1600s, which uses this antique looking font. Does anyone know the name of the font and where I could download it?",2024-12-08 23:28:38
Hey I am trying to learn Amharic I was wondering if someone can translate what this lady is saying. I clipped from a YouTube video. What is “Ashlomondi” can you translate and write what is being said. https://youtube.com/clip/UgkxFPudvzypfbYX9m0zt1fvvty2MliSCAPq?si=27eo-qM6YhDBUwhK,,2024-12-07 14:22:10
"Just found this website, great explanations and teaching style",,2024-12-05 18:00:08
Learn Amharic fidel now. It's easy more than you think. ,,2024-12-05 05:45:49
"How to say ""I don't have"" in Amharic? ","**How to say ""I don't have"" in Amharic? (For those who want to learn Amharic)**

**You can say ""I don't have / it"" in just a second, because it's የለኝም / Yelegnim.**

**Some Examples in contexts:**

**1.  ጊዜ የለኝም። I don’t have time.**

**2.  ሰአት የለኝም። I don’t have time.**

**3.  እስኪርቢቶ የለኝም። I don’t have a pen.**

**4.  ብዕር የለኝም። I don’t have a pen.**

**5.  ስራ የለኝም። I don’t have work.**

**6.  ሳንቲም የለኝም። I don’t have money.**

**7.  ብር የለኝም። I don’t have money.**

**8.  ገንዘብ የለኝም። I don’t have money.**

**9.  መኪና የለኝም። I don’t have a car.**

**10.              ቦታ የለኝም። I don’t have room.**

**11.              በቂ ቦታ የለኝም። I don’t have enough space.**

**The Nouns used in the above sentences:**

**ጊዜ = Time**

**ሰአት = Clock**

**እስኪርቢቶ = Pen**

**ብዕር = Pen**

**ስራ = Work**

**ሳንቲም = Coin**

**ብር  = Birr**

**ገንዘብ = Money**

**መኪና = Car**

**የለኝም = I don't have**

**In Amharic, the verbs always come at the end.**

You can contact me to learn Amharic affordably. ",2024-12-02 17:41:19
Best websites/books/apps to learn amharic?,I looked myself but didnt find alot. Where i live its much easier to learn tigrinya than amharic cause alot more eritreans live here than ethiopians.,2024-12-02 07:52:07
What Level?,"What grade level is this reading? Approximately 

Also if this was the maximum one can read. In terms of difficulty of words, length, and such, from the levels of A1-C2 what level would this be?

Please and Thanks",2024-11-30 02:37:56
A little help with translation please,"Hello my beautiful habesha community. I would like to know what this text means. I found it on a Facebook post. Thanks. 

Mnti Kezira ere ene min agebagn sewyew erasu chigir binorbet new enji ezi ager tefachbgn belo tata yelem …. Zem beye new eko erasun enditeyek new yeteyekut. Enat teru bihon atetefabetm neber

",2024-11-22 09:10:40
Good listening practice tips?,"Thank you for reading this! I was raised in an Amharic speaking household who never actually learned Amharic and trying to make up for it. Does anyone have good recommendations of ways to listen to more Amharic? I’m still trying to figure out how to go about this (I’ve never attempted a second language before besides for mandatory school stuff) and I figured it might be good to incorporate listening to Amharic whenever I can while driving or walking, but I don’t know what or where to listen to things. And advice is appreciated :)",2024-11-20 05:32:32
Can someone please translate this text to English for me? 🙏🏼 ,"እቤ አለ ምን ላርግ አችም በሰላም ሞክሪ ነገሪዉ የምትዉጀ ከሆነ እባክሺ ዛሬም ሰልኩን ጣለ  አሁን ተሻለሺ




I post quite often and I appreciate people helping me a lot! My in laws and fiancé are Ethiopian and sometimes google
Translate isn’t accurate. Thank you so much again!",2024-11-17 03:35:17
I have seen this on wikipedia and I dont know what that means: Tone marks for multiline scored layout are: ᎐ yizet ᎑ deret ᎒ rikrik ᎓ short rikrik ᎔ difat ᎕ kenat ᎖ chiret ᎗ hidet ᎘ deret-hidet ᎙ kurt. ,Is amharic a tonal language?,2024-11-14 15:20:54
Could someone please help me translate this to Amharic? ,"I want to say:

Marti please don’t worry. I have been very sick I was just diagnosed with an autoimmune disease and stress makes me get more sick. I have some money saved up we can consult an immigration lawyer whenever I come. Leul should apply for citizenship. As soon as possible. Whenever we marry at the courthouse it will be harder for him to be deported and that would help him a lot but we were thinking of doing it at the right time. You should also apply for your green card if you’re able. We will talk.
",2024-11-13 12:54:05
Can someone please translate? ,,2024-11-12 00:10:26
Translation needed please ,Please and Thank You. ,2024-10-29 13:27:38
Why and when did አ and ኣ  start being pronounced in the same way?,"At one point, did these letters (like in Tigrinya) have distinct pronunciations in Amharic? What caused them to change? I’m also curious about ሀ and ሃ which observes the same pattern.

It seems possible that medieval or early Amharic retained these sound distinctions, which became less distinct over time. I wonder if this shift was influenced by differences between the Amharic spoken by the nobility and that spoken by the general population, or possibly the result of Cushitic language features becoming more pronounced as Amharic developed (unlike Tigrinya which remained relatively isolated). I haven’t found any resources on this, so any insight would be helpful!
",2024-10-26 14:38:25
"Learn Amharic, Oromiffa or Tigrigna  from Native Speakers - Join Our Exclusive Waitlist",,2024-10-26 09:52:56
Are these letters? ሗ ሧ,I have seen hwa only as ኋ before and swa as ሷ . I didn't know if these versions exist as well in Amharic,2024-10-25 22:06:29
Birthday letter,"My girlfriend's birthday is coming up, she's Ethiopian, raised is Addis. I wanted to translate the birthday message I want to give her into Amharic, then I'll probably write it on a card, can someone help me with this. I don't want Google translate's sloppy translation. Don't laugh at me lol. All the ""I can't waits"" can be swapped with ""I'm excited"" and any other changes that keep the message but make translation make more sense. Thanks in advance.

My love,

It is hard to convey how excited I am. I am excited because being with you has sparked a fire in my life. Our time together has been so precious to me. Full of learning, fun, vulnerability, and peace. I can't wait to do this every year. I can't wait to go on new adventures with you. I can't wait to learn new things with you. I can't wait to have good and hard times with you. I can't wait to explore the mysteries of this life. I am in awe of the values you hold and the character you have. I love your kindness and your ambition We love each other so well and blossom in each others presence and I am honored to have you as my lover. I love you.

",2024-10-23 23:46:41
Resilience in Amharic ,"Can someone help me translate ""resilience"" into Amharic. I know the word for courage and strength but they don't translate the exact meaning of resilience.
Thanks ",2024-10-21 07:37:27
Looking for fellow learners to talk to,"Hi! I've been learning Amharic for like three months and I'd like to find someone to practice together with over Discord - this can be either over call or texting. If you're interested, let me know and I'll give you my Discord username :)",2024-10-08 21:20:48
Make Sure to Subscribe to My Amharic Learning App’s YouTube Channel for Future Amharic Lessons!,"Hey guys,

I've been recently working on a beginner Amharic learning app that will come out soon. You can sign up for the waitlist here: [https://kubayalearning.com/](https://kubayalearning.com/)

In my app, there will be video lessons that cover grammar and other topics in Amharic. New videos will be coming out quick as the app is in the final stages of product. Make sure to subscribe here: [https://www.youtube.com/@kubayalearning](https://www.youtube.com/@kubayalearning)",2024-10-06 05:38:25
Beautiful poem heard on Amharic 96.9 FM in Bahir Dar ...is it in Amharic? who is reading? who wrote it? what does it mean?,,2024-10-05 20:22:34
Reminder to Still Sign Up to My Beginner Amharic Learning App's Waitlist!,"Hi everyone!

I'm currently developing a new free Amharic learning app for beginners. It has many different types of lessons and gamification.

Before creating this app, I did market research. I found the common problems with existing products and have been creating an app that is high quality as well as engaging.

Among its (updated) features are:

* Video, listening, tracing, sentence building and story lessons
* A streak and cups system (gamification)
* A flashcards and leadboard system
* Social system with friends and avatars

Remember that this app is completely free (crazy with all the features it has, right?).

If you're interested, make sure to visit [www.kubayalearning.com](http://www.kubayalearning.com) to join my app's waitlist.",2024-10-05 20:10:39
When to use እርሳቸው and እርስዎ,"I know these are the ""respectful"" forms of ""እሱ/እሷ"" and ""አንተ/አንቺ"" respectively, but in which situations would I refer to people using these pronouns. Would it be when talking to elders, people of high status, etc? And when would it be considered rude to use the regular forms of these pronouns (እሱ/እሷ and አንተ/አንቺ) instead of the respect form (እርሳቸው and እርስዎ). Thank you.",2024-09-26 18:59:48
"Is this what ""average"" handwriting looks like? ","https://preview.redd.it/uhdy0yqfieqd1.png?width=1659&format=png&auto=webp&s=51e9abe5ba688db3d23b878ab7fb42b75435693a

Is this a good model to base my own handwriting off of? Or is it too much?",2024-09-22 18:08:55
Could you please translate what is written on this picture,There are a lot of words all ,2024-09-20 11:52:54
translation,can someone translate Samuel for me?,2024-09-19 04:03:37
Can someone explain to me what this song is about?,,2024-09-15 22:32:25
Needing help translating a feeling from English to Amharic!,"Just to give some context, I wanted to kind of explain the situation I have on hand. A good friend of mine was adopted from Ethiopia when he was 13- his birth mom passed away and he was subsequently adopted by an American family alongside his biological younger sister. 

A few weeks ago, his younger sister passed away in a truly tragic and sudden manner. So, now along side the loss itself, being left in a situation at which he no longer has any remaining blood family members has obviously taken a really big toll on him. 

Additionally, since he'd been adopted at 13, after spending a decent amount of time in the orphanage- his ability to speak or understand Amharic is essentially gone. 

He's allowing me to design a memorial tattoo for him and I'm really wanting to find the best way to communicate the concept I'm going for. I know most things are context related and I'm not going to get anywhere with some translating software or something. 

So, anyway. I'd ideally like to find some sort of saying, phrase, or word that evokes a feeling of ""everything will be okay"", ""we're always here with you"", ""love is eternal"", ""you are never alone"", etc. in some way shape or form. Something to reflect the idea that, just because they aren't physically here with him doesn't mean that their memory/spirit/love/souls have vanished. Some like philosophical reassurance or comforting- even if it's like something like ""our souls are tied"", just something neutral or positive, rather than saying something like ""I am never going to be whole without you. I will wallow in sorrow until the day I die"".  That's super dramatic but you get this point. 

If somebody could help steer me in the right direction I could really use the help!! If there's any further context needed for this to make most sense please let me know!!!",2024-09-13 07:48:05
Is ውሻው ዳቦውን ወዲያውኑ በላ an okay sentence?,"Are these sentences okay in Amharic?

A. ውሻው  **ዳቦውን  ወዲያውኑ**  በላ.  
B. ውሻው  **ዳቦውን  ትናንት**  በላ.

Or do adverbs like ወዲያውኑ and ትናንት have to go before the object like this:

C. ውሻው  **ወዲያውኑ  ዳቦውን**  በላ.  
D. ውሻው  **ትናንት  ዳቦውን**  በላ.",2024-09-11 13:58:10
Wedding Help,"Selam! I am marrying an Ethiopian woman in a couple weeks. My Amharic is okay - greetings, small conversation, etc. I am hoping for help on respectful greetings and thank yous for coming to our wedding /celebration. Hoping to see English translation and pronunciation.  Here are some phrases I’m hoping to know. Wide open to any traditional Amharic saying or recommendations that work in this context.

Thank you for coming!
Great to see you!
We are so excited to be married! 
Thank you for celebrating with us!

Really appreciate your help! Ahmasegahlano!
",2024-09-08 16:55:18
Can someone translate the lyrics of Lemenor by Bezawork Asfaw?,Thinking of getting a tattoo :) much appreciated!!,2024-09-08 03:09:02
How do you form a nationality adjective on Amharic?,"For exaample, Ethiopian, Asian, European, etc. 

English uses -ish, -ian, -ese, -i to form nationality adjectives. So how about Amharic?",2024-09-07 04:34:28
Learning to read and write,"Hello I am a 16 year old kid who was born in Ethiopia but moved out of the country when I was   about 2.

Because my parents speak to each other in Amharic, but talk sometimes Amharic, sometimes English with us kids, I can hear about 65% of words and speak about 50%.

I can have a conversation with people, but I'm not satisfied. Cuz I'm Ethiopian and I want to be completely fluent. On top of that I cannot read or wrote. 

Do you guys have any suggestions on how I can master the language. I already have a pretty good background, but I want mastery

Also what would be the time table to be where I want to be?

Thank you all!",2024-09-06 01:25:06
Can sb please translate this for me?,Or at least try maybe? 🙏🏼 ,2024-09-05 05:56:43
"Hello, could someone please translate this to English?? It’s a bit urgent 🙏🏼 ","የልኡል ላፓቶብ አራዘምሺው እንዴት ሆነ ልኡል ጥሩ አይደለም እርሀብ ገባ በይው ከፍለግሺው እባክሽ ስታወሬው በስላም እያታለልሺ ይበሳጭል ያወራል እባክሺ
",2024-09-01 02:22:55
1874 gras rifle inscription,Inscription on an old french military surplus rifle imported to America from Ethiopia. Could someone please tell me what the transcription says? Thank you,2024-08-31 01:50:56
An Amharic Document,,2024-08-29 11:23:45
Trouble typing on Windows 11,"Hi everyone,

I’m starting to learn Amharic, and I just installed the keyboard to make looking words up easier. I managed to figure out the basics, but then I noticed that I can’t type certain characters: the letter ኀ (plus vowels), some punctuation marks, and numerals. Why is that? Do I *have* to install an extra programme to make it work?

Thanks in advance",2024-08-27 19:35:38
Finding song lyrics,"Hi guys, not a translation request but just a search request.

I am looking for the song lyrics for my 2 favorite songs. “yeteretahulet” by Aster Aweke and “Yamelalsegnal” by Henok Abebe. 

If anyone has them in a format I can copy and paste that would be great! Of course if you want to translate it (I can’t read), that would be awesome but not necessary. ",2024-08-19 10:59:46
Question about ያለው ማነው,"Hello!  I'm trying to work out a detailed translation of this sentence (called a ""gloss"").  This is for a university project I'm doing on Amharic.

ዛሬ      ጥዋት       “ባቡር”    ያለው                  ማነው?   
zare     ṭəwat         babur    y-al-äw              man-äw  
today   morning    train      REL-said-DEF    who-DEF  
'Who said 'train' this morning?'

I'm specifically wondering about ያለው ማነው.  I've tried to break the words down into their constituent parts (prefixes/suffixes), but I'm not sure if I've translated them correctly.  REL stands for ""relative"" – it's what you get in things like **የ**መጣው ሰው ('the man who came'), and DEF stands for ""definite"" – like the definite article ""the"" in English, or in ውሻ**ው** ('the dog').

What I'm trying to figure out is if the ያ- in ያለው is the same type of thing as the relative marker የ- in **የ**መጣው ሰው, and if the two instances of -ው in ያለው ማነው is the same kind of thing as the definite marker -ው in ውሻ**ው**, if that makes sense.  If *not*, does anyone have a sense of what else these prefixes/suffixes might mean?

Also, is the verb ያለው conjugated for third person singular male, like ""he said""?  Or is it just unspecified?

Ameseginalehu!",2024-08-12 02:34:49
Translation request,I’m doing some research for a book and I can’t find a translation to the two phrases in the attached pictures. Could someone please translate?,2024-08-11 23:17:42
