title,content,date
"Amharic is easy, concise and Flexible, not unpredictable as English","# አማርኛ እንዳረጓት ትሆናለች! (ወደ ብልግና እንዳትወስዱት)

In Amharic words are logical and easy to memorize and know the language in shorter time comparing to English where things are not related. For Example,

1. the writing system in English is so awkward, unpredictable and super hard to achieve fluency level in writing unless we use spell checkers or an AI. Even if the letters are 26, the rule is huge.

But in Amharic, since Amharic is rich in phonetics, you can write any Amharic word easily and read it easily.

2. The English words are many, but in Amharic words are short and related, lets see some examples words here even if many words are not like this, but it's helpful. (You will help me on this)

* **መፅሐፍ - Book**
* **ቤተ-መፅሐፍ - Library**
* **መፃፊያ - Pen / table**
* **ፅሑፍ - Writing / Article**
* **ፅህፈት ቤት - Office**
* **ስነ-ፅሁፍ - Literature**

So, if you know the first word, the will be predictable and easy. But in English, things are not related and predictable. So learning English takes much time than Amharic. Semitic languages are beautiful, logical and easy to learn. In Arabic it is also the same. I am amazed with people who says Amharic is difficult.",2025-08-10 05:54:38
"I think this is Amharic, right?","Hello mates,
I have a screenshot of a book's cover, but unfortunately is in a really low quality. Could please tell me whether this is Amharic or not? I can't even recognize the letter (If I would, I'd not doubt it is indeed Amharic). Since it will be someone's native language, one will recognize the meaning by the shape. The book is the red one in the middle.",2025-08-09 08:11:18
"Hello, I'm French, I understand written English and I'd like to learn Amharic as quickly as possible. My mother is Ethiopian but she doesn't have much time to teach me, I'm 21 years",,2025-08-08 09:31:59
Can I get you something translated,"Why is this language so hard?

I was told to use, ""MELAMPDE""

but I am an analytical learner. I need the etymology etc
See pic",2025-08-05 03:13:06
Translation help,"Hello! Can someone please assist me with translation of these two lines of text?

Thank you",2025-07-28 18:44:44
How to Memorize Amharic Words Quickly and Retain them for a Long Time? This Simple Trick allows you to learn Amharic Words quickly.,,2025-07-27 19:03:29
Amharic and Gutturals,"Was there ever a time where Amharic had guttural sounds like Tigrinya?
Or are there locations and dialects today where Amharic is spoken with gutturals?
Ge'ez was spoken with gutturals too I believe, and current speakers do not pronounce quite like it was pronounced say... 1500 years ago in Aksum.",2025-07-27 14:22:37
What did my friend write to me? Thank you,,2025-07-25 08:27:59
Etymology of Igziabher እግዚአብሔር,"Since languages usually have relatively shorter words for ""God"", I'm wondering where Igziabher comes from and if it has any root meanings",2025-07-21 05:36:49
Offering Amharic Lessons - Learn with a Native Speaker!,"Hi everyone!
 
I'm a 24-year-old Ethiopian woman, passionate, energetic, and proud of my culture and language. I'm
offering Amharic lessons to anyone interested in learning from a native speaker - whether you're a
beginner, want to practice conversation, or just explore the language.

I can tailor lessons based on your goals (spoken Amharic, writing, grammar, pronunciation, etc.) and
make the experience engaging and practical.

If you're interested, feel free to DM me for more details!
Looking forward to sharing the beauty of Amharic with you!
 -Semhal",2025-07-20 19:56:24
Learn Amharic Online with a Native Tutor – Just $5/Hour!,"**Learn Amharic Online with a Native Tutor – Just $5/Hour! (Winter Discount**)

Are you looking for a friendly and reliable Amharic tutor who can help you **speak, read, and understand Amharic step by step**—without spending too much?

📚 I’m a native Amharic speaker from Ethiopia with **1 year of online teaching experience**. I teach all kinds of learners—beginners to advanced—for **only $5/hour**.

🕒 I'm available **Monday to Friday** (and weekends too if needed), and I can match your time zone.

👨‍🏫 You will learn:

* The Amharic Alphabet (Fidel)
* Useful daily conversation
* Vocabulary building
* Grammar and sentence structure
* Reading and writing practice

**Watch sample classes on my YouTube channel here:**  
👉 [https://youtu.be/6rPbV\_yuM84?si=2zwIsR1xGBfroUNJ](https://youtu.be/6rPbV_yuM84?si=2zwIsR1xGBfroUNJ)

📞 **Contact Me Now** on WhatsApp or you can call me:  
📱 +251 955404900

Let’s start your Amharic learning journey today!",2025-07-14 11:32:05
Translation request,"Hi everyone, 

I (non-Amharic speaker) came across this beautiful chant from an Orthodox priest and I wanted to know what he said. Could anyone give me an accurate translation of what he said please ? Thanks a lot 🙏",2025-07-12 20:27:10
Learning Amharic and want feedback on approach,"Hi friends! I am trying my best to learn Amharic and wanted feedback on my methods from someone who’s learned the language later in life. 

I’ve broken my approach into a few buckets below. 

Tutoring: 
I currently have a tutor on Italki that I work with a few times a week. After each session, I create Anki cards for each new vocab words, phrases, or verbs we use in the session. These sessions are a mix of speaking practice and grammar learning in the early stages of the language learning process. 

Anki: 
I use Anki to review content that I’ve learned and have been creating a mixture of vocab cards, sentence cards, and adding useful phrases over time to slowly learn how to communicate with strangers. 

Passive learning: 
I’ve heard that watching television is a good way to get language input when you are not operating in the context of the target language you’re hoping to learn. Since I’m not in Ethiopia, I’ve been watching Besintu and other sitcoms to get a feel for how conversations flow. I don’t understand most of what is happening but can pick up key words and some verbs and I can feel my brain stretching to create meaning from the show. 

Altogether, I’m really serious about learning the language and want to make sure I’m approaching this process in a way that makes sense and maximizing my learning. 

Any advice or feedback is welcome! ",2025-07-12 16:30:11
Is this an abridged translation,Count of Monte Cristo / Ifoyta,2025-07-11 07:12:24
Tutor,"Anyone know of the best place to learn Amharic? I would like it in person if there is a site or app I can look in to finding a teacher. Any online tutor, lesson sites recommendations are welcomed.",2025-07-11 06:57:10
HELP,"hi i found a letter my old childhood friend wrote but i cant read what it says, can someone translate it?",2025-07-09 17:11:04
Can someone please help me translate a few Amharic lyrics?,"Hey everyone! There is a Hebrew song with a few Amharic lyrics, and the song is already really special to me and I feel like it would be even more if I could understand the Amharic parts. Could someone please help me out with translating? Even just finding out the lyrics in Amharic  is more than enough! Thank you!!   

https://reddit.com/link/1luzn4y/video/urcpxyuiopbf1/player

",2025-07-08 20:38:20
Looking for an Online Amharic Tutor — $15/day for 3 Hours,"Hello! I'm an English speaker learning Amharic and I'm looking for a native speaker from Ethiopia to tutor me online, Monday–Friday, from 4 AM to 7 AM (which is 12 PM to 3 PM Ethiopia time).

I can pay $15/day ($5/hour) and want to focus on speaking, vocabulary, and some grammar. You don’t need to be a certified teacher — just fluent, reliable, and good at explaining things.

If you're interested, please send me a message and we can try a trial session.

Thank you!",2025-07-06 02:56:59
Help translate artifacts,"Hi, I've been curious to know what the following artifacts say in Amharic, most of all the large canvas telling a story. These belong to my uncle whose wife's grandmother worked in a forgin embassy in Ethiopia for some time in the 1960's. There is lots more that do not contain text such as masks, spears and elephant tusks or ivory figurines. If you can, I'd appreciate any help translating these paintings. Thanks!",2025-07-01 15:54:59
Are there Amharic translations of many classic books?,"I once saw a guard at a hotel reading the Diary of Anne Frank in Amharic. This got me wondering, are most classic books translated in Amharic? I'm thinking of titles such as The Count of Monte Cristo, Anna Karenina, A Christmas Carol, etc. If so, where might one find copies in Addis Ababa?",2025-06-28 14:25:06
What did my friend write?,Thanks.,2025-06-27 05:45:21
"Hello everyone, help is needed!","Recently, I've shared links to the new Instagram and TikTok pages I've made for my soon-to-be-released Amharic language-learning app. If you haven't heard about this, it would be appreciated if you went and gave them a follow:

TikTok: [https://www.tiktok.com/@kubayalearning](https://www.tiktok.com/@kubayalearning)

Instagram: [https://www.instagram.com/kubayalearning/](https://www.instagram.com/kubayalearning/)

I've come into a problem, and that is that these channels aren't reaching Ethiopian communities at all. I'm not based in Ethiopia or the US so TikTok is recommending my videos to mainly people who live in the country I'm in. Please make sure to follow and spread the word so that my channels target the correct audience!",2025-06-25 09:54:12
Make Sure to Follow My Amharic Language-Learning App's New TikTok and Instagram!,"Hello everyone,

  
After creating a YouTube channel for my soon-to-be released Amharic language-learning app, I've decided to make new TikTok and Instagram accounts for it. I'll be posting educational content, content on how I built the app, and regular updates on those pages.

  
Instagram: [https://www.instagram.com/kubayalearning/](https://www.instagram.com/kubayalearning/)

TikTok: [https://www.tiktok.com/@kubayalearning](https://www.tiktok.com/@kubayalearning)

  
App will be coming out soon! Make sure to join the waitlist for early access: [kubayalearning.com](http://kubayalearning.com)",2025-06-22 22:25:11
Can someone here transcribe this video for me?,"[The movie is \\""Barnyard\\"" from 2006](https://reddit.com/link/1lgxgqq/video/514dt0mqea8f1/player)

So, if it's alright to ask, here's an Amharic voice-over of one scene from a 2006 animated movie called ""Barnyard"" - and I'd like to ask for a transcription (writing in Amharic) of what is said in it.  
Translating it to English won't be needed, I think.  
I hope the audio quality is good enough, and I also hope I don't ask for too much - automatic transcription services had trouble with both Amharic itself (it being a rare language) and with the fact it's a voice-over as well, though.  
That all being said, for any help provided, I'll be very grateful!",2025-06-21 14:10:38
ChatGPT Amharic Translation,"ሰላም ሰላም ውድ ቤተሰቦች

I wanted to inquire about your thoughts on the Amharic translation on ChatGPT. I use the translation of ChatGPT for quite a lot of things. It's excellent for a lot of languages, especially European languages, but also Arabic, Japanese, Turkish and the like. Even the Somali is good. The Amharic translation though is extremely lacking. It is currently slightly better I believe, previously it hallucinated an entire language of its own. Currently though, it somewhat makes sense but it spits a lot of gibberish. I demanded it for an explanation, and it told me it's because it wasn't trained on a lot of Amharic material, and I do believe that it's a shame. What are your thoughts on this? Do you care? And if so, do you think we as mere plebeians (and I am sure there are some patricians amongst us too) can effect change?

የእርስዎን አስተያየት ስለ ቻትጂፒቲ የአማርኛ ትርጉም ማወቅ ተፈላጊ ሆነልኝ። ቻትጂፒቲን ለብዙ ነገሮች የትርጉም መሳሪያ በኩል እጠቀማለሁ። ለብዙ ቋንቋዎች በተለይም ለአውሮፓዊ ቋንቋዎች በጣም ጥሩ ነው፤ እንዲሁም ለዓረብኛ፣ ለጃፓንኛ፣ ለቱርክኛ እና እንደነዚህ ቋንቋዎች። እንኳን ሶማሊኛው ደግሞ ጥሩ ነው። ነገር ግን የአማርኛ ትርጉም በጣም ዝቅ ነው። አሁን ጥቂት ይሻለ ማለት ነበርብኝ፤ ቀደም ሲል የራሱን ቋንቋ ተፈጥሯል እንደነበር ይመስለኛል። አሁን ግን ግንዛቤ ያለው ነው እንደሚባል፣ ግን ብዙ ጊዜ የማይረዳ ነገር ይወጣል። ለምን እንደዚህ እንደሚሆን ሲጠየቅ እንደተለጠፈ አማርኛ ብዙ ነገር አልተማረበትም ስለሆነ ነው ብሎ መልሶልኝ። እኔ ራሴ ደግሞ ይህ እንደ አሳፋሪ ነገር አምናለሁ። እርስዎ ስለዚህ ምን ያስባሉ? ይመነጫሉ? እና እንደ በጣም ዝቅተኛ ህዝብ ቢሆንም (ከእኛ መካከል ውስጥ ባላስተዋዮች ቢኖሩም እንጂ) ለዚህ ለውጥ ማመጣት እንችላለን ትላላችሁ?

Damn, that translation wasn't actually that bad considering some atrocious experiences I've had.",2025-06-15 09:02:49
Semitic lang comparison,,2025-06-10 08:13:18
Does anyone know of an intermediate/advanced class or tutor in Addis?,"I'm in Addis Ababa for the next two months and was looking for a class or tutor, specifically intermediate or more. I know how to read but have very basic knowledge of vocab and sentence structures. My goal is to be completely literate even with advanced novels someday. 

Ideally it would be an in-person thing. I got a few recommendations on another subreddit but a lot were online. Will weigh my options",2025-06-02 12:44:20
Question about translation,"Hi everyone ! I (22M, non-Amharic speaker) recently came across this beautiful Orthodox mezmur by the well-known azmari Gebreyohannes Gebretsadik. I wanted to explore the lyrics a little deeper, but I couldn’t find the lyrics. Can someone transcribe them for me please ? Thanks a lot 🙏

https://youtu.be/29SSuGKuXac?si=MKx7dklT-ZmXAB6F",2025-06-01 00:01:03
please advise this text,,2025-05-30 08:53:50
Gift Ideas for My Ethiopian Girlfriend (Amharic Speaker) – Would Love Your Input!,"Selam Reddit Ethiopia,

I’m reaching out with a question from the heart. I’m in a relationship with a wonderful 26-year-old Ethiopian woman who speaks Amharic, and I want to surprise her with a meaningful gift. I truly admire Ethiopian culture and would love to give her something that reflects that appreciation while also making her feel special and seen.

Since I’m not Ethiopian myself, I figured the best way to get this right is to ask you all directly:
What kind of gifts would be especially meaningful, thoughtful, or exciting for an Ethiopian woman?
This could be something cultural, modern, traditional, or even a mix—anything that shows I’ve made a real effort to understand and celebrate her background.

My budget is around 300 to 500 euros, so I’m open to a wide range of suggestions—from unique jewelry or cultural items to experiences, art, music, or anything else you think could really speak to her.

Whether you're speaking from personal experience or just sharing ideas, I’d be truly grateful to hear your thoughts. Thank you in advance—and amesegenallo!",2025-05-16 23:29:32
How to know the difference between ቀ and ከ?,"Hello, I've hade trouble remembering the whick /q/ sound use in word. Does there is a pattern or I have to remember them? ",2025-05-15 18:27:59
What does this say?,,2025-05-10 17:41:14
Second pic is a 19th century Amharic-inscribed cartouche: የእቴጌ ጣይቱ የርስት ቤትዎ ዝንቱ ቤት,,2025-05-09 23:24:49
"✍️ Speak, Read, Write Amharic: Join Our Vibrant Learning Community! 🇪🇹",,2025-05-05 20:26:33
Can anyone translate these three markings on a Lebel 1886 from RTI? Thank you.,The 3rd is a bit illegible and would be fine if it is not translated. Tried my best to get a decent picture showing it.,2025-05-05 08:50:59
ዶ/ር ኩኩ - ለኢትዮጵያ ልጆች,በጥናትና  በልዩ ጥንቃቄ የተዘጋጁ ስለ ሳይንስ፣ ተፈጥሮ፣ ቴክኖሎጂ ፣ ወ.ዘ.ተ የሚያስተምሩ የተለያዩ  ዝግጀቶችን በየሳምንቱ  እሮብ 10 ሰዓት እና ቅዳሜ ጠዋት 4 ስዓት  በቻናላችን እንለቃለን።  ይጠብቁን።  ቤተሰቡን ስለተቀላቀላችሁ እናመሰግናለን። ,2025-05-03 09:24:04
My wedding vows,"I started learning Amharic to be able to allow my husband the ease of speaking his native language at home. He can speak my native language; it’s only fair that I learn his…

I started learning on October 27, 2024, and my main goal was to be able to recite my vows in Amharic. (I got really busy, had to leave town for a month, etc.) I realized I wasn’t going to reach my full goal, so some of my vows in Amharic…

I struggled so much to read them aloud though!",2025-05-01 17:26:36
Quick translation help,"While reading a book, I came across a sentence in which the use of the word ""ደግነቱ"" has me a little confused. 

በትናንትናው ዕለት ጠዋት ቤተሰቡን በጠቅላላ በገመድ አስሮና አንድ ክፍል ውስጥ ዘግቶባቸው ግቢ ውስጥ ሊቀብራቸው ጉድጓድ ሲቆፍር የተጠራጠሩ ጎረቤቶች ደረሱበት ። ደግነቱ ባንዳቸውም ላይ አካላዊ ጉዳት ከማድረሱ በፊት ደረሱበት እንጂ አሰቃቂ ነገር ነበር የሚሆነው ።

From this context, I'm asusming it means "" good thing."" Am I right? And if so this a common way for it to be used? ",2025-05-01 15:05:12
